fold,text,intents,intent_span,intent_span_4o
fold18,How much in advance do I have to book a table for 8 people?,['when'],book a table for 8 people/in advance/How much,How much/book a table
fold18,late check-out,['more_higher_after'],late/check,check
fold18,yes that's my phone I'm trying to locate it,"['affirm', 'lost_stolen']",yes/locate it,trying to locate it/yes
fold18,brand new,['new'],brand new,brand new
fold18,is the indoor pool on the third floor,['request_info'],indoor pool/third floor,indoor pool/third floor
fold18,Can I bring my dog to the restaurant?,['request_info'],Can I bring my dog to the restaurant?,bring my dog/restaurant
fold18,Is there WiFi at the hotel?,['request_info'],WiFi,hotel/WiFi
fold18,theres a broken static bike in the gym,['wrong_notworking_notshowing'],broken static bike,gym
fold18,want to book a room with balcony or terrace.,['make_open_apply_setup_get_activate'],book a room/with balcony or terrace,room/book
fold18,What are the fees for parking?,['how_much'],parking/fees,fees/parking
fold18,Has a wallet been handed in,['lost_stolen'],a wallet/been handed in/Has,wallet/handed in
fold18,"Could you please confirm our booking at the restaurant for tonight, for 2 people?","['existing', 'request_info']",confirm/booking at the restaurant/tonight/2 people,restaurant/booking
fold18,i need to cancel my booking,['cancel_close_leave_freeze'],need to cancel/i/my booking,cancel/booking
fold18,I need to cancel my booking due to some unexpected private reasons...,['cancel_close_leave_freeze'],cancel my booking/unexpected private reasons,cancel/booking
fold18,I need to change the current booking under cabanas.,"['change', 'existing']",change/current booking,booking/current/change
fold18,do you offer skincare treatments?,['request_info'],skincare treatments,skincare treatments
fold18,Do you serve vegan food in your restaurant?,['request_info'],vegan food,restaurant/vegan food
fold18,I want something to eat inside the room,['make_open_apply_setup_get_activate'],want something to eat/inside the room,inside the room/something to eat
fold18,existing one,['existing'],existing,existing
fold18,Can you please reserve a table for 2 people at 4 25 p.m. ?,['make_open_apply_setup_get_activate'],reserve a table/2 people/4 25 p.m.,table/reserve
fold18,Can I change some of the details of a reservation i made the other day,['change'],reservation/change/details,details/reservation/change
fold18,amend that reservation to now also include 3 kids,['change'],include 3 kids/amend/reservation,kids/amend/reservation
fold18,I would like to have the ensuite room for 1 night please,['make_open_apply_setup_get_activate'],ensuite room/1 night,1 night/ensuite room
fold18,it looks to make a reservation I am arriving on Tuesday and leaving on Sunday,['make_open_apply_setup_get_activate'],leaving on Sunday/make a reservation/arriving on Tuesday,arriving/leaving/make a reservation
fold19,Have you got anything between 4 30 in the night and half past 15 afternoon,['request_info'],between 4 30 in the night/half past 15 afternoon,half past 15 afternoon/4 30 in the night
fold19,"thanks, when will I be receiving the money back?","['when', 'thank']",thanks/when will I be receiving the money back,thanks/receiving the money back/when
fold19,Why is the gym closed since yesterday?,"['why', 'wrong_notworking_notshowing']",closed since yesterday/gym,closed/gym/since yesterday/Why
fold19,How do I unlock more channels on the tv?,"['more_higher_after', 'how']",unlock more channels/tv,more channels/How/tv/unlock
fold19,do you have accesible parking?,['request_info'],accessible parking,accesible/parking
fold19,i am not sure of the day we will be leaving,['dont_know'],day we will be leaving/not sure,not sure/day we will be leaving
fold19,Au revoir cheers,['end_call'],cheers/Au revoir,cheers/Au revoir
fold19,Hi am sorry I have to cancel the table for 4 people at 5 10 p.m.,"['greet', 'cancel_close_leave_freeze']",5 10 p.m./table for 4 people/cancel,cancel/Hi
fold19,"no, that didn't solve anything, can I speak with somebody a bit more intelligent?","['deny', 'handoff']","can I speak with somebody a bit more intelligent?/no, that didn't solve anything",speak with somebody/no
fold19,The price was 10% lower last week!,['less_lower_before'],price/10% lower,lower/last week
fold19,I want to do a check-in on behalf of my husband.,['make_open_apply_setup_get_activate'],on behalf of my husband/check,check
fold19,Do I have to pay extra if I checkout later?,"['how_much', 'more_higher_after']",checkout later,pay extra/checkout later
fold19,"yes, do proceed with the booking!","['affirm', 'make_open_apply_setup_get_activate']",proceed with the booking/yes,proceed/yes/booking
fold19,its the first time i make the reservation,['new'],make the reservation/first time,first time/make the reservation
fold19,i might have forgotten the wallet in the pool,['lost_stolen'],wallet/pool/forgotten,wallet/forgotten/pool
fold19,I would like to bring my cat,['request_info'],bring/my cat,bring my cat
fold19,Is WiFi free?,['how_much'],WiFi/free,WiFi/free
fold19,I cannot find a hair dryer and I looked everywhere!,['wrong_notworking_notshowing'],looked everywhere/hair dryer,cannot find/hair dryer
fold19,Is the gym free to use?,['how_much'],gym/free,gym/free
fold19,Can you send some soft drinks and 7 beers to my room at 23:00?,['make_open_apply_setup_get_activate'],23:00/7 beers/my room/soft drinks,23:00/beers/soft drinks/room/send
fold19,I forgot my laptop at claim jumper,['lost_stolen'],claim jumper/forgot/laptop,forgot
fold19,Please cancel my booking at 15 past 3 p.m. as I have changed my mind.,['cancel_close_leave_freeze'],15 past 3 p.m./booking/changed my mind/cancel,changed my mind/cancel my booking
fold19,confirm my reservation is under myles,['existing'],confirm/reservation,reservation/confirm
fold19,can you tell me more detail about the spa,['request_info'],spa,more detail/spa
fold19,do you offer room service?,['request_info'],do you offer/room service,room service
fold19,I'd like to get some whiskey here to the third floor.,['make_open_apply_setup_get_activate'],third floor/whiskey,get
fold19,Ive got a reservation starting on 5th of March,['existing'],starting on 5th of March/reservation,5th of March/reservation
fold19,"At 9 30 evening, I booked a table for 5 people",['existing'],5 people/booked a table,booked a table/9 30 evening/5 people
fold19,please get my restaurant booking changed to at 0:30,['change'],restaurant booking/changed,at 0:30/changed/get/restaurant booking
fold19,change it to 11pm,['change'],11pm/change,11pm/change
fold19,amend hotel reservation,['change'],amend/hotel reservation,amend/hotel reservation
fold19,"I would like a standard room for one adult starting on the 19th of May for 12 nights, please.",['make_open_apply_setup_get_activate'],12 nights/one adult/standard room/19th of May,standard room/starting on the 19th of May/12 nights
fold19,I want to book 2 rooms from 4th to 8th of Jun. It'll be for 1 adult in each room,['make_open_apply_setup_get_activate'],book/1 adult/2 rooms/4th to 8th of Jun,rooms/4th to 8th of Jun/book
fold19,"ok, make a reservation for 9 days for my mother checking in on March 1st",['make_open_apply_setup_get_activate'],March 1st/my mother/make a reservation/checking in/9 days,checking in/make a reservation/ok
